{
  "id": "MOD-003",
  "name": "Deal Pipeline",
  "description": "Sales pipeline management module for tracking deals, stages, forecasting, and revenue opportunities across the sales cycle.",
  "type": "initiative",
  "status": "active",
  "features": [
    "MOD-003-FEAT-005",
    "MOD-003-FEAT-006"
  ],
  "owner": "Sales Platform Team",
  "startDate": "2025-02-15",
  "targetDate": "2025-08-30",
  "metadata": {
    "createdAt": "2025-02-15T11:00:00Z",
    "updatedAt": "2025-02-15T11:00:00Z",
    "createdBy": "sales-director",
    "tags": [
      "crm",
      "deals",
      "pipeline",
      "revenue"
    ]
  }
}
